Name,Category,Year,URL
"Germany, the G20, protectionism and  the Compact with Africa",,2017,https://www.euronews.com/2017/03/13/view-germany-the-g20-protectionism-and-the-compact-with-africa
Central African nations warn Trump reform could lead to conflict,USA,2017,https://www.euronews.com/2017/02/15/central-african-nations-warn-trump-reform-could-lead-to-conflict
Report chronicles deliberate destruction of Aleppo by Russia and Assad,Syria,2017,https://www.euronews.com/2017/02/13/report-chronicles-deliberate-destruction-of-aleppo-by-russia-and-assad
Is Rwanda really better than Romania?,,2017,https://www.euronews.com/2017/02/07/view-is-rwanda-really-better-than-romania
DR Congo veteran opposition leader Etienne Tshisekedi dies aged 84,Democratic Republic Of Congo,2017,https://www.euronews.com/2017/02/01/dr-congo-veteran-opposition-leader-etienne-tshisekedi-dies-aged-84
Morocco: a business bridge to Africa,target,2017,https://www.euronews.com/next/2017/01/04/morocco-a-business-bridge-to-africa
'Syrian' women thank Russian soldiers in controversial calendar,Russia,2016,https://www.euronews.com/2016/12/15/syrian-women-thank-russian-soldiers-in-controversial-calendar
Thousands stream out of Aleppo as rebel deal is struck,Syria,2016,https://www.euronews.com/2016/12/13/thousands-stream-out-of-aleppo-as-rebel-deal-is-struck
‘Little arms and big ideas - fighting for social inclusion’,World,2016,https://www.euronews.com/2016/12/02/little-arms-and-big-ideas-fighting-for-social-inclusion
'Ethnic cleansing' reported in South Sudan,South Sudan,2016,https://www.euronews.com/2016/12/01/ethnic-cleansing-reported-in-south-sudan
Rwanda accuses French officials of complicity in genocide,France,2016,https://www.euronews.com/2016/11/30/rwanda-accuses-french-officials-of-complicity-in-genocide
Media & conflicts: domestic and international media threatened in Central Africa,Democratic Republic Of Congo,2016,https://www.euronews.com/2016/11/21/media-conflicts-domestic-and-international-media-threatened-in-central-africa
"Media & conflicts: dangerous liaisons, an INFOCORE study reveals",World,2016,https://www.euronews.com/2016/11/21/media-conflicts-dangerous-liaisons-an-infocore-study-reveals
James Nachtwey: we must think deeply before people commit to war,World,2016,https://www.euronews.com/2016/10/21/james-nachtwey-we-must-think-deeply-before-people-commit-to-war
'Historic' climate change deal reached in Rwanda,Rwanda,2016,https://www.euronews.com/2016/10/15/historic-climate-change-deal-reached-in-rwanda
Tanzania quake kills 13 and injures nearly 200,Tanzania,2016,https://www.euronews.com/2016/09/11/tanzania-quake-kills-13-and-injures-nearly-200
13 people - including nine children - die in fighting in Aleppo,Syria,2016,https://www.euronews.com/2016/08/05/13-people-including-nine-children-die-in-fighting-in-aleppo
Verdi's African-themed Macbeth impresses in Athens,Cult,2016,https://www.euronews.com/culture/2016/07/31/verdi-s-african-themed-macbeth-impresses-in-athens
"African passport launched, Idris Deby & Paul Kagame get first copies",Africanews,2016,https://www.euronews.com/2016/07/17/african-passport-launched-idris-deby-paul-kagame-get-first-copies
"Sudan's al-Bashir in Rwanda for summit, despite ICC arrest warrant",world news,2016,https://www.euronews.com/2016/07/17/sudan-s-al-bashir-in-rwanda-for-summit-despite-icc-arrest-warrant
21 Africans receive Queen Elizabeth's 'Young Leaders Award',Africanews,2016,https://www.euronews.com/culture/2016/06/24/21-africans-receive-queen-elizabeth-s-young-leaders-award
War photographer James Nachtwey wins Asturias award,Spain,2016,https://www.euronews.com/2016/05/19/photographer-nachtwey-wins-asturias-award
Former Rwandan mayors go on trial in France for 1994 genocide,France,2016,https://www.euronews.com/2016/05/10/former-rwandan-mayors-go-on-trial-in-france-for-1994-genocide
Africanews.com: most read stories,World,2016,https://www.euronews.com/2016/04/20/africanews-com-most-read-stories
Rwanda and the fight against genocide ideology,Rwanda,2016,https://www.euronews.com/2016/04/07/rwanda-and-the-fight-against-genocide-ideology
"Public funding, private loans - whatever it takes to get an education",World,2016,https://www.euronews.com/2016/04/01/public-funding-private-loans-whatever-it-takes-to-get-an-education
'Miles Ahead': inside a jazz icon's creative block,Cinema,2016,https://www.euronews.com/culture/2016/04/01/miles-ahead-inside-a-jazz-icon-s-creative-block
UN pays tribute after death of 'memorable' ex-chief Boutros-Ghali,world news,2016,https://www.euronews.com/2016/02/16/un-pays-tribute-after-death-of-memorable-ex-chief-boutros-boutros-ghali
DRC parties hard as fans celebrate nation's CHAN 2016 victory,Africanews,2016,https://www.euronews.com/2016/02/08/drc-parties-hard-as-fans-celebrate-nation-s-chan-2016-victory
Setting emergency standards for aid and education,World,2016,https://www.euronews.com/2016/01/22/setting-emergency-standards-for-aid-and-education
Rwandan President Paul Kagame to seek a third term in 2017,Rwanda,2016,https://www.euronews.com/2016/01/01/rwandan-president-paul-kagame-to-seek-a-third-term-in-2017
"Rwandans vote 'yes' to extending Kagame's term, partial results suggest",world news,2015,https://www.euronews.com/2015/12/19/rwandans-vote-yes-to-extending-kagame-s-term-partial-results-suggest
AU ready to deploy East African Stanby Force to Burundi,Africanews,2015,https://www.euronews.com/2015/12/17/au-ready-to-deploy-east-african-stanby-force-to-burundi
Burundi: Tensions heighten as trial begins for failed coup plotters,Africanews,2015,https://www.euronews.com/2015/12/15/burundi-tensions-heighten-as-trial-begins-for-failed-coup-plotters
Burundi announces security crackdown after months of violence,Burundi,2015,https://www.euronews.com/2015/11/09/burundi-announces-security-crackdown-after-months-of-violence
African Games: Algeria claim men's volleyball gold,Sport,2015,https://www.euronews.com/2015/09/16/african-games-algeria-claim-men-s-volleyball-gold
Hundreds of African migrants released from Israeli detention centre,Israel,2015,https://www.euronews.com/2015/08/25/hundreds-of-african-migrants-released-from-israeli-detention-centre
Burundi: radio silence leaves room for political violence,Burundi,2015,https://www.euronews.com/2015/08/19/burundi-radio-silence-leaves-room-for-political-violence
Red Cross reunites lost refugee children with families in Rwanda,Rwanda,2015,https://www.euronews.com/2015/08/13/red-cross-reunites-lost-refugee-children-with-families-in-rwanda
Burundi's past overshadows Nkurunziza's pursuit of power,Burundi,2015,https://www.euronews.com/2015/07/21/burundi-s-past-overshadows-nkurunziza-s-pursuit-of-power
Rwanda's spy chief bailed after being arrested in London,United Kingdom,2015,https://www.euronews.com/2015/06/26/rwanda-s-spy-chief-bailed-after-being-arrested-in-london
"Burundi elections put off again, fears of violence rise",Burundi,2015,https://www.euronews.com/2015/06/04/burundi-elections-put-off-again-fears-of-violence-rise
Burundi opposition calls for president to quit,Burundi,2015,https://www.euronews.com/2015/06/01/burundi-opposition-calls-for-president-to-quit
Burundi president calls for 'ethnic harmony',Burundi,2015,https://www.euronews.com/2015/05/21/burundi-president-calls-for-ethnic-harmony
Anti-president protest in Burundi ends in clashes with police,Burundi,2015,https://www.euronews.com/2015/05/19/anti-president-protest-in-burundi-ends-in-clashes-with-police
Aid workers face 'complex emergency' as Burundians flee unrest,Burundi,2015,https://www.euronews.com/2015/05/19/aid-workers-face-complex-emergency-as-burundians-flee-unrest
Burundi failed coup leader 'overestimated army's support',World,2015,https://www.euronews.com/2015/05/15/burundi-failed-coup-leader-overestimated-army-s-support
Women join anti-Nkurunziza protests in Burundi,Burundi,2015,https://www.euronews.com/2015/05/11/women-join-anti-nkurunziza-protests-in-burundi
Burundi women protest Nkurunziza third term,Burundi,2015,https://www.euronews.com/2015/05/10/burundi-women-protest-nkurunziza-third-term
"50,000 people flee Burundi amid violent protests",Burundi,2015,https://www.euronews.com/2015/05/09/50000-people-flee-burundi-amid-violent-protests
More deaths as Burundi's President Nkurunziza fails to calm protests,Burundi,2015,https://www.euronews.com/2015/05/07/more-deaths-as-burundi-s-president-nkurunziza-fails-to-calm-protests
Burundi: three killed as violence continues to rock capital,Burundi,2015,https://www.euronews.com/2015/05/02/burundi-three-killed-as-violence-continues-to-rock-capital
Burundi: police fire live rounds to disperse anti-president protesters,Burundi,2015,https://www.euronews.com/2015/04/28/burundi-police-fire-live-rounds-to-disperse-anti-president-protesters
Thousands flee Burundi amid second day of pre-election violence,Burundi,2015,https://www.euronews.com/2015/04/27/thousands-flee-burundi-amid-second-day-of-pre-election-violence
Gabon to host the 2017 Africa Cup of Nations,Sport,2015,https://www.euronews.com/2015/04/08/gabon-to-host-the-2017-africa-cup-of-nations
HIV test via your smartphone in 15 minutes,Sci-tech,2015,https://www.euronews.com/2015/03/03/hiv-test-via-your-smartphone-in-15-minutes
Ireland makes legal gender equality history,Ireland,2015,https://www.euronews.com/2015/02/13/female-solicitors-in-ireland-make-gender-equality-history-
Sakharov Prize winner Mukwege on justice for DRC's women,World,2014,https://www.euronews.com/2014/11/26/sakharov-prize-winner-mukwege-calls-for-justice-and-deliverance-for-drc-s-women
Caver Francesco Sauro explores mysterious Tepui table mountains,Sci-tech,2014,https://www.euronews.com/2014/08/01/caver-francesco-sauro-explores-mysterious-tepui-table-mountains
Africa maintains growth momentum despite security challenges,focus,2014,https://www.euronews.com/next/2014/05/28/africa-maintains-growth-momentum-despite-security-challenges
Rwandan reconciliation difficult 20 years on,World,2014,https://www.euronews.com/2014/04/07/rwandan-reconciliation-difficult-20-years-on
"Europe and Africa, working together to build investment opportunities",focus,2014,https://www.euronews.com/next/2014/04/02/europe-and-africa-working-together-to-build-investment-opportunities
France faced with long and costly CAR mission,World,2013,https://www.euronews.com/2013/12/11/france-faced-with-long-and-costly-car-mission
Save the Children report: Niger praised but globally much remains to be done,Niger,2013,https://www.euronews.com/2013/10/23/save-the-children-report-niger-praised-but-globally-much-remains-to-be-done-
The happiest countries around the world,World,2013,https://www.euronews.com/2013/09/10/the-happiest-countries-around-the-world
Football: Kick-starting education,World,2012,https://www.euronews.com/2012/06/08/football-kick-starting-education
Rape as a weapon: the fight of Masika,World,2012,https://www.euronews.com/2012/04/27/rape-as-a-weapon
DR Congo: harvesting on the ruins of war,Unreported Europe,2011,https://www.euronews.com/2011/11/03/rwanda-harvesting-the-ruins-of-war
Focus: quenching the world's water thirst,focus,2011,https://www.euronews.com/next/2011/09/02/focus-quenching-the-world-s-water-thirst
Global challenges: water in an urbanising world,focus,2011,https://www.euronews.com/next/2011/08/24/global-challenges-water-in-an-urbanising-world
Saving the African Union,focus,2011,https://www.euronews.com/next/2011/07/05/saving-the-african-union
"Tunisia, Egypt - a wake up call for Africa?",World,2011,https://www.euronews.com/2011/06/09/tunisia-egypt-a-wake-up-call-for-africa
A class from the past,World,2011,https://www.euronews.com/2011/06/06/a-class-from-the-past
ECHO: a lifeline in Africa's skies,Unreported Europe,2010,https://www.euronews.com/2010/10/08/echo-a-lifeline-in-africa-s-skies
