Name,Category,Year,URL
Which countries have been removed from the UK's red list?,Travel News,2021,https://www.euronews.com/travel/2021/10/07/uk-removes-travel-restrictions-for-47-countries
UK travel: Amber list scrapped as of 4am today,Travel News,2021,https://www.euronews.com/travel/2021/10/04/uk-travel-amber-list-scrapped-as-of-4am-today
Man behind the inspiration for Hotel Rwanda convicted of terror charge,Rwanda,2021,https://www.euronews.com/2021/09/20/man-behind-the-inspiration-for-hotel-rwanda-convicted-of-terror-charges
Photo gallery: Burundi's women's status is being rethought,Culture Series,2021,https://www.euronews.com/culture/2021/08/19/photo-gallery-burundi-s-women-s-status-is-being-rethought
Gino Strada: Italian surgeon and Emergency NGO founder dies aged 73,Italy,2021,https://www.euronews.com/2021/08/13/gino-strada-italian-surgeon-and-emergency-ngo-founder-dies-aged-73
Travel-loving vegans need to check out this luxury holiday company,Experiences,2021,https://www.euronews.com/travel/2021/08/12/worried-about-what-there-ll-be-to-eat-this-travel-company-takes-the-stress-out-of-vegan-ho
Emmanuel Macron identifed as potential Pegasus spyware target,Biztech news,2021,https://www.euronews.com/next/2021/07/21/pegasus-spyware-scandal-emmanuel-macron-among-14-heads-of-states-identified-as-possible-ta
Pegasus spyware scandal: What we know so far,Biztech news,2021,https://www.euronews.com/next/2021/07/20/what-is-pegasus-the-israeli-mobile-phone-spyware-used-by-governments-around-the-world
Podcast | Liberia's invisible war wound: from warrior to black sheep,Culture Series,2021,https://www.euronews.com/culture/2021/06/24/podcast-liberia-s-child-soldiers-face-ptsd-as-they-seek-their-place-in-post-war-society
Can American citizens travel to Europe? Here are the latest updates,Travel News,2021,https://www.euronews.com/travel/2021/06/21/can-american-citizens-travel-to-europe-here-are-the-latest-updates
Not bad enough for genocide? The towns the Mladić verdict downplayed,Bosnia and Herzegovina,2021,https://www.euronews.com/2021/06/11/not-bad-enough-for-genocide-the-bosnian-towns-feeling-cheated-by-mladic-verdict
Why is Denmark under fire over new law to send asylum seekers abroad?,Denmark,2021,https://www.euronews.com/2021/06/07/everything-we-currently-know-about-denmark-s-plans-for-offshore-refugee-centres
'Shameful abdication': Denmark slammed over plan to outsource asylum,Denmark,2021,https://www.euronews.com/2021/06/03/denmark-passes-a-law-to-send-its-asylum-seekers-outside-of-europe
Macron warns France could withdraw troops from Mali following coup,France,2021,https://www.euronews.com/2021/05/30/macron-warns-france-could-withdraw-troops-from-mali-following-coup
Thousands leave Goma after more volcanic activity,no comment,2021,https://www.euronews.com/2021/05/27/thousands-leave-goma-after-more-volcanic-activity
France 'inflicted suffering on Rwanda by staying silent over genocide',Rwanda,2021,https://www.euronews.com/2021/05/27/france-inflicted-suffering-on-rwanda-with-silence-over-genocide-admits-macron
"Congo volcano kills 15 people, thousands flee",Democratic Republic Of Congo,2021,https://www.euronews.com/2021/05/23/congo-volcano-kills-15-people-thousands-of-others-flee
Mount Nyiragongo erupted at night and sent thousands of Congolese fleeing in panic,no comment,2021,https://www.euronews.com/2021/05/23/mount-nyiragongo-erupted-at-night-and-sent-thousands-of-congolese-fleeing-in-panic
The EU is officially welcoming vaccinated travellers in summer 2021,Travel News,2021,https://www.euronews.com/travel/2021/05/19/the-eu-is-welcoming-vaccinated-travellers-in-summer-2021-here-s-what-you-need-to-know
EU states agree to allow entry to bloc for vaccinated travellers,Europe,2021,https://www.euronews.com/2021/05/19/eu-states-agree-to-allow-entry-to-bloc-for-vaccinated-travellers
"Portugal, Netherlands latest EU countries to ease travel restrictions",Europe,2021,https://www.euronews.com/2021/05/15/portugal-netherlands-latest-eu-countries-to-ease-travel-restrictions
US envoy arrives for talks with Israeli and Palestinian officials,Israel,2021,https://www.euronews.com/2021/05/13/death-toll-mounts-in-gaza-and-israel-as-violence-enters-its-fourth-day
Does Denmark want to send its refugees to Rwanda?,Denmark,2021,https://www.euronews.com/2021/05/06/does-denmark-want-to-send-its-refugees-to-rwanda
EU Commission recommends entry of fully vaccinated non-EU travellers,brussels bureau,2021,https://www.euronews.com/2021/05/03/eu-commission-recommends-entry-of-fully-vaccinated-non-eu-travellers
Dubai might be the perfect destination right now,Destinations,2021,https://www.euronews.com/travel/2021/04/22/how-dubai-is-keeping-tourists-and-residents-safe
Rwanda genocide report: France 'did nothing to stop' massacres,Rwanda,2021,https://www.euronews.com/2021/04/19/france-bears-significant-responsibility-for-enabling-the-1994-rwanda-genocide-report
"Greece removes quarantine for EU, UK, US and other travellers",Travel News,2021,https://www.euronews.com/travel/2021/04/19/greece-lifts-quarantine-requirement-for-travellers-from-eu-and-dozen-other-countries
Rwanda Genocide Anniversary,no comment,2021,https://www.euronews.com/2021/04/07/rwanda-genocide-anniversary
"France 'was not complicit' in Rwandan genocide, report claims",France,2021,https://www.euronews.com/2021/03/26/france-bears-heavy-responsibilities-for-rwandan-genocide-but-was-not-complicit-report-says
Tourist selfies could be spreading COVID-19 to endangered gorillas,Nature,2021,https://www.euronews.com/green/2021/02/17/tourists-selfies-could-be-spreading-covid-to-endangered-mountain-gorillas
What are the new UK hotel quarantine rules and who do they apply to?,Travel News,2021,https://www.euronews.com/travel/2021/02/09/all-uk-arrivals-face-10-000-fine-and-10-year-prison-sentence-for-breaking-new-quarantine-r
US declares China is 'committing genocide' against Uighur minority,USA,2021,https://www.euronews.com/2021/01/20/us-declares-china-is-committing-genocide-against-uighur-minority
Polls open in Central African Republic elections amid fears of unrest,Central African Republic,2020,https://www.euronews.com/2020/12/27/polls-open-in-central-african-republic-amid-fears-of-unrest-in-first-elections-since-peace
Three UN peacekeepers killed in Central African Republic,Central African Republic,2020,https://www.euronews.com/2020/12/26/three-un-peacekeepers-killed-in-central-african-republic
France sends flyover mission to Central African Republic,World,2020,https://www.euronews.com/2020/12/24/france-sends-flyover-mission-to-central-african-republic-amid-election-tensions
These pixelated images show the importance of wildlife conservation,Green News,2020,https://www.euronews.com/green/2020/12/04/these-pixelated-images-show-the-importance-of-wildlife-conservation
Ultra-rare rhino birth is caught on camera at Chester Zoo,Green News,2020,https://www.euronews.com/green/2020/11/16/conservationists-celebrate-as-birth-of-ultra-rare-rhino-is-caught-on-camera-at-chester-zoo
Where can I book a holiday in Europe during lockdown?,Travel News,2020,https://www.euronews.com/travel/2020/11/06/where-can-i-book-a-holiday-in-europe-during-lockdown
"To understand healthy masculinity, look to Africa | View",Culture Series,2020,https://www.euronews.com/culture/2020/10/30/to-understand-healthy-masculinity-look-to-africa-view
Pope appoints Wilton Gregory as first African American cardinal,USA,2020,https://www.euronews.com/2020/10/25/pope-appoints-washington-archbishop-wilton-gregory-as-first-african-american-cardinal
Which European countries have COVID-19 border restrictions in place?,Travel News,2020,https://www.euronews.com/travel/2020/10/21/which-european-countries-have-opened-their-borders-ahead-of-the-summer-holiday-season
Why has French judiciary let Charlie Hebdo terrorism trial be filmed?,France,2020,https://www.euronews.com/2020/09/02/charlie-hebdo-is-the-first-terrorism-trial-in-france-to-be-filmed-here-s-why-
Hotel Rwanda's real-life hero arrested over 'terrorism' charges,Rwanda,2020,https://www.euronews.com/2020/09/01/hotel-rwanda-s-real-life-hero-arrested-over-terrorism-charges
What Americans should know about Europe’s travel restrictions,Travel News,2020,https://www.euronews.com/travel/2020/08/21/what-americans-should-know-about-europe-s-travel-restrictions
Algerians no longer allowed into EU after COVID-19 case spike,brussels bureau,2020,https://www.euronews.com/2020/07/30/algerians-no-longer-allowed-into-eu-after-covid-19-case-spike
Algerians and Moroccans set to lose permission to travel to EU,brussels bureau,2020,https://www.euronews.com/2020/07/28/algerians-and-moroccans-set-to-lose-permission-to-travel-to-eu-after-covid-19-spike
Greece shuts Serbia border amid COVID-19 spike in the Balkans,World,2020,https://www.euronews.com/2020/07/06/coronavirus-greece-shuts-serbia-border-amid-covid-19-spike-in-the-balkans
Trump’s ICC attack shows his contempt for the rule of law ǀ View,,2020,https://www.euronews.com/2020/07/02/donald-trump-s-attack-on-the-icc-shows-his-contempt-for-the-global-rule-of-law-view
Analysis: Europe's airline industry and flying during a pandemic,world news,2020,https://www.euronews.com/2020/06/29/analysis-europe-s-airline-industry-and-flying-during-a-coronavirus-pandemic
EU recommends lifting travel restrictions on 15 countries from July 1,World,2020,https://www.euronews.com/2020/06/29/revealed-draft-list-of-countries-that-will-be-allowed-to-enter-eu-when-borders-open
Rwanda genocide: French court ruling could shed light on France's role,France,2020,https://www.euronews.com/2020/06/07/rwanda-genocide-french-court-ruling-could-shed-light-on-france-s-role
Félicien Kabuga arrested near Paris for role in Rwandan genocide,World,2020,https://www.euronews.com/2020/05/16/felicien-kabuga-arrested-near-paris-for-role-in-rwandan-genocide
Analysis: Africa's unexpected COVID-19 figures,brussels bureau,2020,https://www.euronews.com/2020/05/12/analysis-africa-s-unexpected-covid-19-figures
World Happiness: Finland takes top ranking for third year in a row,Finland,2020,https://www.euronews.com/2020/03/20/world-happiness-finland-takes-top-ranking-for-third-year-in-a-row
The 60 best sustainable clothing brands to wean you off fast fashion,Living,2020,https://www.euronews.com/green/2020/01/21/the-60-best-sustainable-clothing-brands-to-wean-you-off-fast-fashion
Gamifying kindness: 'Positive energy can change the world',Living,2019,https://www.euronews.com/green/2019/12/13/gamifying-kindness
Rwanda’s port – creating a hub for Intra-African trade,Rwanda,2019,https://www.euronews.com/2019/11/29/rwanda-s-port-creating-a-hub-for-intra-african-trade
African business summit heralds new opportunities for regional trade,Business,2019,https://www.euronews.com/2019/11/28/african-business-summit-heralds-new-opportunities-for-regional-trade
"The Berlin Wall fell 30 years ago. Democracy seemed to have won out, but we were wrong ǀ View",,2019,https://www.euronews.com/2019/11/11/berlin-wall-fell-30-years-ago-democracy-seemed-have-won-view
Fabien Neretsé stands trial on genocide charges in Belgium,brussels bureau,2019,https://www.euronews.com/2019/11/07/former-rwandan-official-fabien-neretse-stands-trial-on-genocide-charges-in-belgium
"""Overtourism"" ruining some of the world's most beautiful destinations",Destinations,2019,https://www.euronews.com/travel/2019/11/06/overtourism-ruining-some-of-the-world-s-most-beautiful-destinations
'Waiting for justice': Families await start of Rwanda genocide trial,Good Morning Europe,2019,https://www.euronews.com/2019/11/04/waiting-for-justice-families-await-start-of-rwanda-genocide-trial-in-belgium
Families seek justice as Rwandan genocide trial begins,brussels bureau,2019,https://www.euronews.com/2019/11/04/families-seek-justice-as-rwandan-genocide-trial-begins
Fighting racism on the runway: black issues in Red Square,Living,2019,https://www.euronews.com/green/2019/10/31/facing-racism-on-the-runway
5 incredible eco-resorts helping to save endangered animals,Green News,2019,https://www.euronews.com/green/2019/09/10/5-incredible-eco-resorts-helping-to-save-endangered-animals
South Africa wants to lead the Fourth Industrial Revolution,focus,2019,https://www.euronews.com/next/2019/09/10/south-africa-wants-to-lead-the-fourth-industrial-revolution
The Brief: 'Just dealing with Ebola and walking away is unacceptable',brussels bureau,2019,https://www.euronews.com/2019/09/05/the-brief-just-dealing-with-ebola-and-walking-away-is-unacceptable
Congolese girl with Ebola dies after traveling to Uganda,USA,2019,https://www.euronews.com/2019/08/30/girl-ebola-entering-uganda-congo-dies-total-number-cases-rise-n1048171
Watch: Parade puts blackface in Belgium back in spotlight,Belgium,2019,https://www.euronews.com/2019/08/26/watch-blackface-in-belgium-back-in-the-spotlight-after-controversial-parade
Women lead the efforts to tackle inequality in Rwanda,Good Morning Europe,2019,https://www.euronews.com/2019/08/22/women-lead-the-efforts-to-tackle-inequality-in-rwanda
What's the G7? A look at the economic summit coming to France,France,2019,https://www.euronews.com/2019/08/13/what-is-the-g7-a-look-at-the-economic-summit-coming-to-france-this-month
U.S. Ebola patients mark 5 years since recovery as outbreak rages in Congo,USA,2019,https://www.euronews.com/2019/08/02/former-u-s-ebola-patients-mark-5-years-recovery-while-n1038556
Rwanda closes border with DR Congo after third Ebola case,Democratic Republic Of Congo,2019,https://www.euronews.com/2019/08/01/rwanda-closes-border-with-dr-congo-after-third-ebola-case-detected-in-goma
Rwanda seals Congo border after third Ebola case in city of Goma,USA,2019,https://www.euronews.com/2019/08/01/rwanda-seals-congo-border-after-third-ebola-case-goma-n1038141
9 of the best must-have sustainable summer jewellery looks,Living,2019,https://www.euronews.com/green/2019/07/28/9-of-the-best-must-have-sustainable-summer-jewellery-looks
Why has WHO declared Ebola emergency a year after outbreak started?,Democratic Republic Of Congo,2019,https://www.euronews.com/2019/07/19/why-has-who-declared-ebola-emergency-a-year-after-outbreak-started
Congo confirms first Ebola case in the eastern city of Goma,Democratic Republic Of Congo,2019,https://www.euronews.com/2019/07/15/congo-confirms-first-ebola-case-in-the-eastern-city-of-goma
Watch: Endangered rhinos take trip of a lifetime from Europe to Africa,Rwanda,2019,https://www.euronews.com/2019/06/26/watch-endangered-rhinos-take-trip-of-a-lifetime-from-europe-to-africa
A drone just flew a kidney to a transplant patient for the first time ever. It won't be the last.,USA,2019,https://www.euronews.com/2019/05/03/drone-just-flew-kidney-transplant-patient-first-time-ever-it-ncna1001396
Which countries have highest proportion of women in parliament?,World,2019,https://www.euronews.com/2019/05/01/which-countries-in-europe-have-the-highest-proportion-of-women
Rwanda honours those killed in genocide that began 25 years ago,no comment,2019,https://www.euronews.com/2019/04/08/rwanda-honours-those-killed-in-genocide-that-began-25-years-ago
Male refugees victimized by sexual violence say U.N. staffer wanted bribes to help them,USA,2019,https://www.euronews.com/2019/04/08/asylum-sale-male-refugees-victimized-sexual-violence-say-officials-wanted-n988396
"25 years after genocide, Rwanda has a new light, says leader",USA,2019,https://www.euronews.com/2019/04/07/25-years-after-genocide-rwanda-has-new-light-says-leader-n991846
Rwanda marks 25th anniversary of genocide,Rwanda,2019,https://www.euronews.com/2019/04/07/rwanda-remembers-those-killed-in-genocide-25-years-ago
Belgium apologises for abducting mixed-race children in colonial-era,Belgium,2019,https://www.euronews.com/2019/04/05/belgium-apologises-for-abduction-of-thousands-of-mixed-race-children-during-colonial-era
Trump admin to ban entry of International Criminal Court investigators,USA,2019,https://www.euronews.com/2019/03/15/trump-admin-ban-entry-international-criminal-court-investigators-n983766
"'No survivors' in Ethiopian Airlines crash, CEO confirms",Ethiopia,2019,https://www.euronews.com/2019/03/10/ethiopia-airlines-flight-crashes-with-157-onboard-spokesman-confirms
A.I. and world trade take centre stage at 7th World Government Summit,Business Line,2019,https://www.euronews.com/next/2019/02/25/a-i-advances-and-world-trade-take-centre-stage-at-7th-world-government-summit
High-ranking Syrian suspected of crimes against humanity arrested in Germany,USA,2019,https://www.euronews.com/2019/02/14/syrian-suspected-crimes-against-humanity-arrested-germany-n971456
How to offset your travels,Green News,2019,https://www.euronews.com/green/2019/02/05/how-to-offset-your-travels
How African citizens protect themselves against Internet shutdowns,World,2019,https://www.euronews.com/2019/01/26/african-governments-use-internet-shutdowns-to-silence-opposition-more-and-more-what-can-pe
World Economic Forum 2019: What to expect at this year's Davos,Switzerland,2019,https://www.euronews.com/2019/01/20/world-economic-forum-2019-what-to-expect-at-this-year-s-davos
Design of single African Union passport for all to be unveiled,World,2019,https://www.euronews.com/2019/01/11/design-of-single-african-union-passport-for-all-to-be-unveiled-this-year
Five stories to know about today,World,2018,https://www.euronews.com/2018/12/27/live-updates-ukraine-martial-law-italy-quake-france-drops-charges-against-rwandan-official
France drops charges against Rwandan officials,Rwanda,2018,https://www.euronews.com/2018/12/26/france-drops-charges-against-rwandan-officials
France clears Rwandan officials of killing president in 1994,Africanews,2018,https://www.euronews.com/2018/12/26/france-clears-rwandan-officials-in-1994-president-killing-case
Drones fly vaccines to remote island in first-of-its-kind delivery,world news,2018,https://www.euronews.com/2018/12/19/drones-fly-vaccines-remote-island-first-its-kind-delivery-ncna950041
"How one Sandy Hook mother found forgiveness, hope and a mission",world news,2018,https://www.euronews.com/culture/2018/12/14/sandy-hook-5-years-later-scarlett-lewis-s-road-healing-t119829
Which EU countries ranked highest for food sustainability in 2018?,World,2018,https://www.euronews.com/2018/11/27/which-european-countries-ranked-highest-for-food-sustainability-in-2018
Japan: education partner of Rwanda,Global Japan,2018,https://www.euronews.com/2018/11/22/japan-partners-with-rwanda-in-education-initiative
Victory for conservationists as rare Mountain gorilla population rises,World,2018,https://www.euronews.com/2018/11/15/victory-for-conservationists-as-rare-mountain-gorilla-population-rises
Ethiopia: Abiy Ahmed gives 50% of ministerial roles to women,Ethiopia,2018,https://www.euronews.com/2018/10/17/ethiopia-abiy-ahmed-moves-gender-politics-forward-with-cabinet-parity-the-cube
Kigali's thriving art scene proof of the healing power of culture,Rwanda,2018,https://www.euronews.com/2018/10/02/kigali-s-thriving-art-scene-proof-of-the-healing-power-of-culture
"After the Rohingya Muslim genocide, a Nuremberg trial is essential | View",,2018,https://www.euronews.com/2018/09/04/after-the-rohingya-muslim-genocide-a-nuremberg-trial-is-essential-view
Mnangagwa urges Zimbabwe to unite behind his presidency,Zimbabwe,2018,https://www.euronews.com/2018/08/26/mnangagwa-urges-zimbabwe-to-unite-behind-his-presidency
Reality TV show gets participants to 'live like refugees',world news,2018,https://www.euronews.com/2018/08/25/go-back-where-you-came-retraces-reverse-refugee-route-n903081
Watch: United Nations pays tribute to Kofi Annan,no comment,2018,https://www.euronews.com/2018/08/21/watch-united-nations-pays-tribute-to-kofi-annan
Former UN Secretary-General Kofi Annan dies aged 80,world news,2018,https://www.euronews.com/2018/08/18/former-un-secretary-general-kofi-annan-dies-aged-80
Failed conflicts threaten to overshadow Annan’s legacy,Switzerland,2018,https://www.euronews.com/2018/08/18/syria-rwanda-and-other-failed-conflicts-threaten-to-overshadow-annan-s-legacy
Kofi Annan's life with the UN,world news,2018,https://www.euronews.com/2018/08/18/kofi-annan-s-life-with-the-un
"Inspire Africa: Innovative entrepreneurs from Senegal, Rwanda and Cameroon",Africanews,2018,https://www.euronews.com/2018/06/25/inspire-africa-innovative-entrepreneurs-from-senegal-rwanda-and-cameroon
Rwanda defends Arsenal deal,Rwanda,2018,https://www.euronews.com/2018/05/29/rwanda-defends-arsenal-deal
Six trends we spotted at VivaTech,Sci-tech,2018,https://www.euronews.com/next/2018/05/25/six-trends-we-spotted-at-vivatech
"Invoking MLK and slavery, American bishop breaks ground at royal wedding",world news,2018,https://www.euronews.com/2018/05/19/michael-curry-sermon-touching-civil-rights-royal-wedding-n875696
British tourists kidnapped in Congo speak out after being freed,Democratic Republic Of Congo,2018,https://www.euronews.com/2018/05/13/british-tourists-kidnapped-in-congo-are-released
Woman who died trying to protect Brit tourists from kidnappers is named,Republic of the Congo,2018,https://www.euronews.com/2018/05/12/congo-authorities-continue-search-for-kidnapped-british-tourists
Rwanda's champions of locally made fashion,Africanews,2018,https://www.euronews.com/2018/05/12/rwanda-s-champions-of-locally-made-fashion
Mass grave found in Rwanda,Rwanda,2018,https://www.euronews.com/2018/04/27/mass-grave-found-in-rwanda
U.S. investigates alleged atrocities committed against Rohingya,world news,2018,https://www.euronews.com/2018/04/25/u-s-investigates-alleged-atrocities-committed-against-myanmar-s-rohingya-n868986
"Blood-carrying drones could save lives in the US, Here's how",world news,2018,https://www.euronews.com/2018/04/24/blood-carrying-drones-could-save-lives-us-here-s-how-ncna868561
Analysis: what is the Commonwealth?,world news,2018,https://www.euronews.com/2018/04/19/analysis-what-is-the-commonwealth-
The Commonwealth: 4 questions answered,United Kingdom,2018,https://www.euronews.com/2018/04/19/the-commonwealth-4-questions-answered
Israel frees migrants pending deportation as Netanyahu struggles to placate coalition partners,Israel,2018,https://www.euronews.com/2018/04/05/israel-frees-migrants-pending-deportation-as-netanyahu-struggles-to-placate-coalition-part
"Netanyahu bows to right-wing pressure, axes migrant deal after just hours",world news,2018,https://www.euronews.com/2018/04/03/israel-s-netanyahu-changes-his-mind-migrant-resettlement-plan-n862266
Israel cancels plan to deport thousands of migrants to Africa,world news,2018,https://www.euronews.com/2018/04/02/israel-strikes-u-n-deal-send-thousands-african-migrants-western-n861956
Megan Markle joins Royal Family for Commonwealth Day celebrations,United Kingdom,2018,https://www.euronews.com/2018/03/13/meghan-markle-joins-royal-family-for-commonwealth-day-celebrations
Two wounded in refugee camp food rationing protest,Rwanda,2018,https://www.euronews.com/2018/02/22/two-wounded-in-refugee-camp-food-rationing-protest
Israel tells illegal Africans to leave before April or face jail,Israel,2018,https://www.euronews.com/2018/01/02/israel-tells-illegal-africans-to-leave-before-april-or-face-jail
Even Europe's money can't stop climate change refugees: View,world news,2017,https://www.euronews.com/2017/12/06/even-europe-s-money-can-t-stop-climate-change-refugees
Prince Harry to marry Meghan Markle at Windsor Castle in May,United Kingdom,2017,https://www.euronews.com/2017/11/28/good-team-harry-and-meghan-give-first-interview-since-announcing-engagement
Rohingya crisis deepens in Bangladesh,World,2017,https://www.euronews.com/2017/11/06/rohingya-exodus-compared-to-rwanda
Kenya Votes 2017: Have a look at the electoral system,Africanews,2017,https://www.euronews.com/2017/10/25/kenya-votes-2017-have-a-look-at-the-electoral-system
Trump calls for UN reform ahead of maiden speech to world leaders,USA,2017,https://www.euronews.com/2017/09/19/trump-calls-for-un-reform-ahead-of-maiden-speech-to-world-leaders
A glimpse at the life-changing work of an ocularist,world news,2017,https://www.euronews.com/2017/09/07/a-glimpse-at-the-life-changing-work-of-an-ocularist
Kagame sworn in for another term leading Rwanda,Rwanda,2017,https://www.euronews.com/2017/08/18/kagame-sworn-in-for-another-term-leading-rwanda
Syria investigator Del Ponte tells Euronews why she quit,Syria,2017,https://www.euronews.com/2017/08/08/syria-investigator-carla-del-ponte-tells-euronews-why-she-quit-commission
Del Ponte quits UN over Syria,Switzerland,2017,https://www.euronews.com/2017/08/06/del-ponte-quits-un-over-syria
Rwanda strongman Kagame wins election landslide,Rwanda,2017,https://www.euronews.com/2017/08/05/rwanda-strongman-kagame-wins-election-landslide
Kagame expected to win third term in Rwandan presidentials,Rwanda,2017,https://www.euronews.com/2017/08/04/kagame-expected-to-win-third-term-in-rwandan-presidentials
"Merkel urges more investment, weapons for Africa",Germany,2017,https://www.euronews.com/2017/06/12/merkel-urges-more-investment-weapons-for-africa
"'The US has long supported international justice, now it should be subjected to it'",USA,2017,https://www.euronews.com/2017/04/27/the-us-has-long-supported-international-justice-now-it-should-be-subjected-to-it
Made in Morocco: An African tour,target,2017,https://www.euronews.com/next/2017/04/18/made-in-morocco-an-african-tour
Rwandans demand apology from French media for 'photo misrepresentation',Africanews,2017,https://www.euronews.com/2017/03/23/rwandans-demand-apology-from-french-media-for-photo-misrepresentation
Norway tops UN list of happiest countries on earth,Norway,2017,https://www.euronews.com/2017/03/20/norway-tops-un-list-of-happiest-countries-on-earth
